timestamp,question #,question,A,B,C,correct,wrong,tryed_to_solve,right
2/2/2018 20:04,1,What did Yankee Doodle stick in his cap?,Feather,Noodle soup,Duck,A,,NO_TRY,
2/2/2018 20:05,2,"What word completes the phrase: ""Everything but the kitchen""?",Sink,Kaleidoscope,Hogwash,A,,NO_TRY,
2/2/2018 20:05,3,What was the first theatrical feature film to be completely computer-animated?,Gone with the Wind,Toy Story 2,Toy Story,C,,,RIGHT
2/2/2018 20:06,4,"Traditionally, an ""amuse-bouche"" arrives right before what part of the meal?",Appetizers,Entrée,Dessert,A,,,RIGHT
2/2/2018 20:07,5,"In the game of Candy Land, which player goes first?",The youngest,Blue token holder,First to draw a red card,A,,NO_TRY,
2/2/2018 20:08,6,"In the popular comic strip, what color is Hagar the Horrible's beard?",White,Blond,Red,C,,,RIGHT
2/2/2018 20:10,7,What spice comes from the crocus flower?,Cloves,Allspice,Saffron,C,,,RIGHT
